เมนูนี้กินได้ไหม,การกิน
กินอันนี้ได้หรือเปล่า,การกิน
เมนูนี้้กินได้รึเปล่า,การกิน
การกินของผู้ป่วย,การกิน
กินอะไร,การกิน
ต้องนอนยังไง,การนอน
นอนกี่ชั่วโมง,การนอน
นอนวันละเท่าไหร่,การนอน
พักผ่อนแค่ไหนถึงดี,การนอน
นอนหลับกี่ชั่วโมง,การนอน
นอนหลับกี่่โมง,การนอน
นอนหลับเวลาไหน,การนอน
หลับกี่ชั่วโมง,การนอน
หลับแค่ไหนถึงดี,การนอน
ต้องนอนวันละกี่ชั่วโมง,การนอน
หลับวันละกี่ชั่วโมง,การนอน
นอนตอนไหน,การนอน
หลับกี่ทุ่ม,การนอน
ต้องพักผ่อนกี่ชั่วโมง,การนอน
ออกกำลังกายยังไง,การออกกำลังกาย
การออกกำลังกาย,การออกกำลังกาย
ออกกำลังกายวันละเท่าไหร่,การออกกำลังกาย
อยากรู้เรื่องการออกกำลังกาย,การออกกำลังกาย
ออกกำลังกายเท่าไหร่ถึงดี,การออกกำลังกาย
ออกกำลังกายวันละกี่ชั่วโมง,การออกกำลังกาย
ออกกำลังกายวันละกี่ี่นาที,การออกกำลังกาย
ท่าออกกำลังกาย,การออกกำลังกาย
ออกกำลังกายแบบไหน,การออกกำลังกาย
ควรออกกำลังยังไง,การออกกำลังกาย
ออกกำลังกายได้ไหม,การออกกำลังกาย
ควรออกกำลังกายแบบใด,การออกกำลังกาย
ออกกำลังกาย,การออกกำลังกาย
ออกกำลังท่าไหนได้บ้าง,การออกกำลังกาย
ควรออกกำลังกายยังไง,การออกกำลังกาย
เป็นไข้มา 3 วัน หนาวสั่น ปวดเมื่อย คอแห้ง,ไข้
เป็นไข้ต่ำๆเจ็บคอ ปวดตามร่างกาย หูอื้อ มึนหัว ,ไข้
"
มีอาการไม่สบายตัว หลับไม่สนิท ปวดศีรษะ มีไข้ต่ำๆ เกิดจากอะไร",ไข้
"
มีไข้ ปวดท้อง อาเจียน กินอะไรไม่ลง ปวดหัว ควรพบแพทย์ไหม",ไข้
มีไข้,ไข้
"
มีไข้ ​37.5 ถึง 37.8 คอแห้ง เสี่ยงไหม ควรดูแลเบื้องต้นอย่างไร",ไข้
รู้สึกตัวร้อน วัดอุณหภูมิได้ 37 แบบนี้เรียกว่ามีไข้ไหม,ไข้
"
รู้สึกมีไข้ต่ำๆ เป็นๆหายๆ มักเป็นช่วงกลางคืน หายใจได้ปกติ เป็นอาการอะไร",ไข้
"
มีไข้ขึ้นๆลงๆ มา 2-3 วัน มีไอ เจ็บคอ ร่วมด้วย เป็นอะไร",ไข้
"
ลูกมีไข้​ 38.8 ไม่มีน้ำมูก​ ไม่ไอ​ แต่บอกว่าปวดหัว​ กินอาหารแล้วอาเจียน ร่าเริงปกติ เกิดจากอะไร",ไข้
"
มีไข้ที่ 37.5 มา 3-4วัน ไม่มีอาการปวดหัว หรือไอ มีอาการคอแห้ง ปวดเมื่อยตามตัว ใจเต้นแรง เป็นอะไร",ไข้
"
มีไข้อ่อนๆมา 3 วัน กินยาลดไข้แล้ว ยังรู้สึกตัวอุ่นๆตลอดเวลา ควรไปหาหมอไหม",ไข้
"
มีไข้สูง",ไข้
เป็นไข้ มีอาการหนาวสั่น มือซีด หน้าซีด ปากม่วง เกิดจากอะไร,ไข้
"
มีไข้ ปวดตามตัว เพลีย ลุกไม่ไหว มันคืออะไร",ไข้
"
รู้สึกมีไข้ ไอมา 2 อาทิตย์ติดแล้ว เบื่ออาหาร เป็นอาการอะไร",ไข้
มีไข้สูง ,ไข้
เป็นไข้นานหลายวัน แต่ไม่ไอ ไม่เจ็บคอ ,ไข้
ปวดหัว ตัวร้อน มีไข้สูงมาก เพลียมาก,ไข้
"
มีไข้สูง ตัวร้อน",ไข้
ตัวร้อน,ไข้
รู้สึกมีไข้ ตัวร้อน ,ไข้
กินอะไรได้บ้าง,การกิน
ควรกินอะไร,การกิน
กินอะไรดี,การกิน
ควรกินอะไร,การกิน
ควรรับประทานอะไร,การกิน
รับประทานอะไรได้บ้าง,การกิน
รับประทานอะไรดี,การกิน
แนะนำอาหารที่ควรรับประทานหน่อย,การกิน
แนะนำเมนูที่ควรกิน,การกิน
แนะนำเมนููที่ควรรับประทาน,การกิน
เมนูที่ควรกิน,การกิน
เมนููที่ควรรับประทาน,การกิน
เมนู,การกิน
อาหารที่ควรกิน,การกิน
แนะนำอาหารหน่อย,การกิน
อาหารอะไรบ้างที่กินได้,การกิน
ขอข้อมูลติดต่อโรงพยาบาล,ช่องทางการติดต่อ 
ติดต่อได้ยังไง,ช่องทางการติดต่อ 
ติดต่อที่ไหน,ช่องทางการติดต่อ 
ติดต่อยังไง,ช่องทางการติดต่อ 
ขอมูลต่อติด,ช่องทางการติดต่อ 
ดูแลตัวเองยังไง,ดูแลสุขภาพ
ขอวิธีดูแลสุขภาพ,ดูแลสุขภาพ
ดูแลสุขภาพยังไง,ดูแลสุขภาพ
อยากขอวิธีดูแลผู้ป่วย,ดูแลสุขภาพ
ดูแลผู้ป่วย,ดูแลสุขภาพ
ดูแลผูู้ป่วยยังไง,ดูแลสุขภาพ
ดูผลคนไข้ยังไง,ดูแลสุขภาพ
ดูแลสุุขภาพผู้ป่วยยังไง,ดูแลสุขภาพ
วิธีดูแลสุขภาพผู้ป่วย,ดูแลสุขภาพ
วิธีดูแลสุขภาพคนไข้,ดูแลสุขภาพ
ต้องดูแลตัวเองยังไง,ดูแลสุขภาพ
ต้องดูแลคนไข้ยังไง,ดูแลสุขภาพ
ต้องดูแลผู้ป่วยยังไง,ดูแลสุขภาพ
จะต้องดูแลสุขภาพยังไง,ดูแลสุขภาพ
จะต้องดููแลผู้ป่วยยังไง,ดูแลสุขภาพ
จะต้องดูแลคนไข้ยังไง,ดูแลสุขภาพ
สวัสดีครับ,ทักทาย
สวัสดีค่ะ,ทักทาย
สวัสดีคะ,ทักทาย
สวัสดีคับ,ทักทาย
สวัสดี,ทักทาย
หวัดดี,ทักทาย
hi,ทักทาย
hello,ทักทาย
ว่าไง,ทักทาย
ดีครับ,ทักทาย
ดีคะ,ทักทาย
ดีค่ะ,ทักทาย
ขอที่อยูโรงพยาบาล,ช่องทางการติดต่อ 
โรงพยาบาลอยู่ตรงไหน,ช่องทางการติดต่อ 
โรงบาลอยู่ไหน,ช่องทางการติดต่อ 
ที่อยู่,ช่องทางการติดต่อ 
อยู่ไหน,ช่องทางการติดต่อ 
อยู่แถวไหน,ช่องทางการติดต่อ 
ไปยังไง,ช่องทางการติดต่อ 
ไปอย่างไร,ช่องทางการติดต่อ 
อยู่ตรงไหน,ช่องทางการติดต่อ 
โรงพยาบาลตั้งอยู่ที่ไหน,ช่องทางการติดต่อ 
ที่ตั้งของโรงพยาบาล,ช่องทางการติดต่อ 
โรงบาลตั้งอยู่ไหน,ช่องทางการติดต่อ 
ที่ตั้ั้งของโรงบาล,ช่องทางการติดต่อ 
โรงบาลอยูู่แถวไหน,ช่องทางการติดต่อ 
เบอร์โทรศัพท์,ช่องทางการติดต่อ 
ขอเบอร์ติดต่อหน่อย,ช่องทางการติดต่อ 
โทรไปเบอร์ไหน,ช่องทางการติดต่อ 
เบอร์โทร,ช่องทางการติดต่อ 
เบอร์มือถือ,ช่องทางการติดต่อ 
เบอร์ติดต่อ,ช่องทางการติดต่อ 
โทรไปได้ที่ไหน,ช่องทางการติดต่อ 
โทรไปเบอร์ไหน,ช่องทางการติดต่อ 
โทรไปที่ไหน,ช่องทางการติดต่อ 
โทรไปยังไง,ช่องทางการติดต่อ 
จะโทรหาเบอร์อะไร,ช่องทางการติดต่อ 
ติดต่อได้ที่เบอร์ไหน,ช่องทางการติดต่อ 
เบอร์อะไร,ช่องทางการติดต่อ 
กินอะไรได้ไม่ได้,การกิน
รับประทานอะไรไม่ได้,การกิน
ไม่ควรรับประทานอะไร,การกิน
ห้ามกินอะไร,การกิน
ห้ามรับประทานอะไร,การกิน
เมนูที่่ห้ามกิน,การกิน
เมนูที่กินไม่ได้,การกิน
อาหารที่ี่กินไม่ได้,การกิน
ห้ามกินเมนูอะไร,การกิน
ห้ามกินอาหารอะไร,การกิน
ห้ามรับประทานอะไร,การกิน
อาหารที่ไม่ควรกิน,การกิน
อาหารที่ห้ามกิน,การกิน
อาหารที่กินไม่ได้,การกิน
ไม่กินอะไร,การกิน
ขอเว็บไซต์หน่อย,ช่องทางการติดต่อ 
เว็บไหน,ช่องทางการติดต่อ 
เว็บอะไร,ช่องทางการติดต่อ 
เว็บของโรงพยาบาลคืออะไร,ช่องทางการติดต่อ 
เว็บไซต์,ช่องทางการติดต่อ 
ขอเว็บหน่อย,ช่องทางการติดต่อ 
ขอ url หน่อย,ช่องทางการติดต่อ 
เช็คได้ที่เว็บไหน,ช่องทางการติดต่อ 
อ่านได้ที่เว็บไหน,ช่องทางการติดต่อ 
เว็บ url อะไร,ช่องทางการติดต่อ 
url ของโรงพยาบาล,ช่องทางการติดต่อ 
ติดต่อที่เว็บไหน,ช่องทางการติดต่อ 
url เว็บคืออะไร,ช่องทางการติดต่อ 
เว็บไซต์อะไร,ช่องทางการติดต่อ 
เว็บไซต์ไหน,ช่องทางการติดต่อ 
ดูที่เว็บไซต์อะไร,ช่องทางการติดต่อ 
website,ช่องทางการติดต่อ 
website อะไร,ช่องทางการติดต่อ 
เช็คได้ที่website ไหน,ช่องทางการติดต่อ 
website ของโรงพยาบาล,ช่องทางการติดต่อ 
ขอwebหน่อยดิ,ช่องทางการติดต่อ 
webไรอะ,ช่องทางการติดต่อ 
webโรงพยาบาล,ช่องทางการติดต่อ 
website โรงบาล,ช่องทางการติดต่อ 
ขออีเมล,ช่องทางการติดต่อ 
ขอ email,ช่องทางการติดต่อ 
email,ช่องทางการติดต่อ 
เมล,ช่องทางการติดต่อ 
อีเมล,ช่องทางการติดต่อ 
"จะได้เตียงวันไหน
",จะได้เตียงวันไหน
เมื่อไหร่จะได้เตียง,จะได้เตียงวันไหน
เตียงจะว่างวันไหน,จะได้เตียงวันไหน
เมื่อไหร่จะได้ห้อง,จะได้เตียงวันไหน
จะได้ห้องวันไหน,จะได้เตียงวันไหน
มีห้องไหม,จะได้เตียงวันไหน
มีเตียงไหม,จะได้เตียงวันไหน
เตียงจะได้เมื่อไหร่,จะได้เตียงวันไหน
ห้องจะได้เมื่อไหร่,จะได้เตียงวันไหน
เตียงจะได้เมื่อไร,จะได้เตียงวันไหน
วันไหนจะได้เตียง,จะได้เตียงวันไหน
วันไหนจะได้ห้อง,จะได้เตียงวันไหน
รักษายังไง,ถามเกี่ยวกับวิธีรักษา
มีวิธีการรักษาอะไรบ้าง,ถามเกี่ยวกับวิธีรักษา
วิธีการรักษา,ถามเกี่ยวกับวิธีรักษา
วิธีผ่าตัดคืออะไร,ถามเกี่ยวกับวิธีรักษา
การรักษาด้วยวิธีการผ่าตัด,ถามเกี่ยวกับวิธีรักษา
มีวิธีรักษามะเร็งกี่วิธี,ถามเกี่ยวกับวิธีรักษา
มีวิธีรักษาอะไรบ้าง,ถามเกี่ยวกับวิธีรักษา
จะรักษาได้อย่างไร,ถามเกี่ยวกับวิธีรักษา
วิธีการรักษาด้วยเคมีบำบัด,ถามเกี่ยวกับวิธีรักษา
อยากรู้เกี่ยวกับเคมีบำบัด,ถามเกี่ยวกับวิธีรักษา
มีวิธีการรักษาวิธีใดบ้าง,ถามเกี่ยวกับวิธีรักษา
เคมีบำบัดรักษาได้ไหม,ถามเกี่ยวกับวิธีรักษา
ผ่าตัดจะรักษาได้ไหม,ถามเกี่ยวกับวิธีรักษา
วิธีการผ่าตัดจะรักษาได้ไหม,ถามเกี่ยวกับวิธีรักษา
การฉายรังสีจะรักษาได้ไหม,ถามเกี่ยวกับวิธีรักษา
วิธีการรักษาด้วยการผ่าตัด,ถามเกี่ยวกับวิธีรักษา
วิธีการรักษาด้วยการฉายรังสี,ถามเกี่ยวกับวิธีรักษา
ฉายรังสีจะรักษาได้ไหม,ถามเกี่ยวกับวิธีรักษา
วิธีการรักษาระยะที่1,ถามเกี่ยวกับวิธีรักษา
วิธีการรักษาระยะที่2,ถามเกี่ยวกับวิธีรักษา
วิธีการรักษาระยะที่3,ถามเกี่ยวกับวิธีรักษา
วิธีการรักษาระยะที่4,ถามเกี่ยวกับวิธีรักษา
ระยะที่1รักษายังไง,ถามเกี่ยวกับวิธีรักษา
ระยะที่2รักษายังไง,ถามเกี่ยวกับวิธีรักษา
ระยะที่3รักษายังไง,ถามเกี่ยวกับวิธีรักษา
ระยะที่4รักษายังไง,ถามเกี่ยวกับวิธีรักษา
การฉายรังสีรักษาได้ไหม,ถามเกี่ยวกับวิธีรักษา
วิธีรักษาด้วยการฉายรังสี,ถามเกี่ยวกับวิธีรักษา
จะรักษาด้วยวิธีการฉายรังสีได้ไหม,ถามเกี่ยวกับวิธีรักษา
จะรักษาด้วยวิธีการคีโมได้ไหม,ถามเกี่ยวกับวิธีรักษา
จะรักษาด้วยวิธีการเคมีบำบัดได้ไหม,ถามเกี่ยวกับวิธีรักษา
คีโมรักษาได้ไหม,ถามเกี่ยวกับวิธีรักษา
วิธีรักษาด้วยคีโม,ถามเกี่ยวกับวิธีรักษา
การทำคีโมรักษาได้ไหม,ถามเกี่ยวกับวิธีรักษา
ยามุ่งเป้ารักษาได้ไหม,ถามเกี่ยวกับวิธีรักษา
จะใช้ยามุ่งเป้ารักษา,ถามเกี่ยวกับวิธีรักษา
อะไรคือคีโม,ถามเกี่ยวกับวิธีรักษา
อะไรคือยามุ่งเป้า,ถามเกี่ยวกับวิธีรักษา
การใช้ยามุ่งเป้า,ถามเกี่ยวกับวิธีรักษา
การรักษาด้วยการใช้ยามุ่งเป้า,ถามเกี่ยวกับวิธีรักษา
รักษาด้วยยามุ่งเป้า,ถามเกี่ยวกับวิธีรักษา
การรักษาด้วยยามุ่งเป้า,ถามเกี่ยวกับวิธีรักษา
ยามุ่งเป้ารักษาได้ไหม,ถามเกี่ยวกับวิธีรักษา
ยามุ่งเป้ารักษายังไง,ถามเกี่ยวกับวิธีรักษา
การฉายแสงจะรักษาได้ไหม,ถามเกี่ยวกับวิธีรักษา
การรักษาด้วยการฉายแสง,ถามเกี่ยวกับวิธีรักษา
วิธีการรักษาด้วยการฉายแสง,ถามเกี่ยวกับวิธีรักษา
วิธีการรักษาด้วยการใช้ยามุ่งเป้า,ถามเกี่ยวกับวิธีรักษา
วิธีการรักษาด้วยคีโม,ถามเกี่ยวกับวิธีรักษา
วิธีการรักษาด้วยการใช้เคมีบำบัด,ถามเกี่ยวกับวิธีรักษา
มีวิธีการรักษากี่วิธี,ถามเกี่ยวกับวิธีรักษา
มีวิธีรักษาวิธีอะไรบ้าง,ถามเกี่ยวกับวิธีรักษา
วิธีการรักษาด้วยการกระตุ้นภูมิคุ้มกัน,ถามเกี่ยวกับวิธีรักษา
รักษาด้วยวิธีกระตุ้นภูมิคุ้มกันได้ไหม,ถามเกี่ยวกับวิธีรักษา
จะใช้วิธีกระตุ้นภูมิคุ้มกันได้หรือเปล่า,ถามเกี่ยวกับวิธีรักษา
การรักษาด้วยภูมิคุ้มกัน,ถามเกี่ยวกับวิธีรักษา
วิธีการรักษาด้วยภูมิคุ้มกัน,ถามเกี่ยวกับวิธีรักษา
การรักษาด้วยการใช้ภูมิคุ้มกัน,ถามเกี่ยวกับวิธีรักษา
มีวิธีการใช้ภูมิคุ้มกันไหม,ถามเกี่ยวกับวิธีรักษา
ภูมิคุ้มกันรักษาได้หรือเปล่า,ถามเกี่ยวกับวิธีรักษา
การให้ยากระตุ้มภูมิคุ้มกัน,ถามเกี่ยวกับวิธีรักษา
มีวิธีการรักษาใดบ้าง,ถามเกี่ยวกับวิธีรักษา
สิทธิการรักษามะเร็งของคนไทย,สิทธิการรักษา
ใช้สิทธิการรักษาได้ไหม,สิทธิการรักษา
30 บาทได้ไหม,สิทธิการรักษา
ใช้สวัสดิการรักษาได้หรือเปล่า,สิทธิการรักษา
30บาทรักษาทุกโรค,สิทธิการรักษา
ใช้สิทธิอะไรได้บ้าง,สิทธิการรักษา
เป็นข้าราชการรักษาได้ไหม,สิทธิการรักษา
ใช้สวัสดิการข้าราชการได้ไหม,สิทธิการรักษา
ข้าราชการต้องเสียเงินไหม,สิทธิการรักษา
มีสิทธิการรักษาไหม,สิทธิการรักษา
ใช้สิทธิการรักษาอะไรได้บ้าง,สิทธิการรักษา
ทำประกันไว้ได้หรือเปล่า,สิทธิการรักษา
ใช้ประกันได้ไหม,สิทธิการรักษา
บัตรทองใช้ได้ไหม,สิทธิการรักษา
